{
  "schemaVersion": "voice-model-catalog-envelope.v1",
  "keyId": "sm-test-1",
  "algorithm": "ed25519",
  "payload": "ewogICJzY2hlbWFWZXJzaW9uIjogInZvaWNlLW1vZGVsLWNhdGFsb2cudjEiLAogICJjYXRhbG9nVmVyc2lvbiI6IDMsCiAgImlzc3VlZEF0IjogIjIwMjYtMTAtMTdUMDA6MDA6MDBaIiwKICAidm9pY2VzIjogWwogICAgewogICAgICAiaWQiOiAiZml4dHVyZS1idW5kbGVkIiwKICAgICAgImRpc3BsYXlOYW1lIjogIkZpeHR1cmUgQnVuZGxlZCBWb2ljZSIsCiAgICAgICJwdWJsaXNoZXIiOiAiRXhhbXBsZSBQdWJsaXNoZXIiLAogICAgICAidmVyc2lvbiI6ICIwLjgiLAogICAgICAicnVudGltZSI6IHsKICAgICAgICAibmFtZSI6ICJvbm54cnVudGltZSIsCiAgICAgICAgInZlcnNpb24iOiAiMS4yNC4yIgogICAgICB9LAogICAgICAibWluaW11bUlPU1ZlcnNpb24iOiAiMjYiLAogICAgICAibWluaW11bU1lbW9yeU1lZ2FieXRlcyI6IDIwNDgsCiAgICAgICJzdGF0dXMiOiAiYXZhaWxhYmxlIiwKICAgICAgImJ1bmRsZWQiOiB0cnVlLAogICAgICAiZmlsZXMiOiBbXSwKICAgICAgImxpY2Vuc2VzIjogWwogICAgICAgIHsKICAgICAgICAgICJpZCI6ICJmaXh0dXJlLWFwYWNoZSIsCiAgICAgICAgICAibmFtZSI6ICJBcGFjaGUgTGljZW5zZSAyLjAiLAogICAgICAgICAgInNwZHhJZCI6ICJBcGFjaGUtMi4wIiwKICAgICAgICAgICJ0ZXh0VVJMIjogImh0dHBzOi8vd3d3LmFwYWNoZS5vcmcvbGljZW5zZXMvTElDRU5TRS0yLjAudHh0IiwKICAgICAgICAgICJ0ZXh0U0hBMjU2IjogImNmYzc3NDliOTZmNjNiZDMxYzNjNDJiNWM0NzFiZjc1NjgxNDA1M2U4NDdjMTBmM2ViMDAzNDE3YmM1MjNkMzAiLAogICAgICAgICAgInJlcXVpcmVzQWNjZXB0YW5jZSI6IGZhbHNlCiAgICAgICAgfQogICAgICBdCiAgICB9LAogICAgewogICAgICAiaWQiOiAiZml4dHVyZS12b2ljZSIsCiAgICAgICJkaXNwbGF5TmFtZSI6ICJGaXh0dXJlIFZvaWNlIiwKICAgICAgInB1Ymxpc2hlciI6ICJFeGFtcGxlIFB1Ymxpc2hlciIsCiAgICAgICJ2ZXJzaW9uIjogIjEuMCIsCiAgICAgICJydW50aW1lIjogewogICAgICAgICJuYW1lIjogIm9ubnhydW50aW1lIiwKICAgICAgICAidmVyc2lvbiI6ICIxLjI0LjIiCiAgICAgIH0sCiAgICAgICJtaW5pbXVtSU9TVmVyc2lvbiI6ICIyNi4wIiwKICAgICAgIm1pbmltdW1NZW1vcnlNZWdhYnl0ZXMiOiA0MDk2LAogICAgICAic3RhdHVzIjogImF2YWlsYWJsZSIsCiAgICAgICJidW5kbGVkIjogZmFsc2UsCiAgICAgICJmaWxlcyI6IFsKICAgICAgICB7CiAgICAgICAgICAicGF0aCI6ICJtb2RlbC5vbm54IiwKICAgICAgICAgICJieXRlQ291bnQiOiAyMCwKICAgICAgICAgICJzaGEyNTYiOiAiNjNiYjI5ZjY1NTJlN2UzYTJmNjJmNjY3NzcwZTYzMTM5NjMxMzQ0NDUyODA5ZWRjNWIzMjM2YmRlNWMzMjYwZiIsCiAgICAgICAgICAic291cmNlcyI6IFsKICAgICAgICAgICAgImh0dHBzOi8vbW9kZWxzLmV4YW1wbGUub3JnL2ZpeHR1cmUtdm9pY2UvMS4wL21vZGVsLm9ubngiLAogICAgICAgICAgICAiaHR0cHM6Ly9taXJyb3IuZXhhbXBsZS5uZXQvZml4dHVyZS12b2ljZS8xLjAvbW9kZWwub25ueCIKICAgICAgICAgIF0sCiAgICAgICAgICAibGljZW5zZUlkIjogImZpeHR1cmUtcmFpbCIKICAgICAgICB9LAogICAgICAgIHsKICAgICAgICAgICJwYXRoIjogInN0eWxlcy9hLmpzb24iLAogICAgICAgICAgImJ5dGVDb3VudCI6IDE0LAogICAgICAgICAgInNoYTI1NiI6ICI5YTU3OGVlZTZjMWY3YTY5MWU2YWY3OTk4MTgwN2JhOTk3ZDUzNGI0OGZhNzM4N2IxN2RlZmE4NDE0MTg5MzgxIiwKICAgICAgICAgICJzb3VyY2VzIjogWwogICAgICAgICAgICAiaHR0cHM6Ly9tb2RlbHMuZXhhbXBsZS5vcmcvZml4dHVyZS12b2ljZS8xLjAvc3R5bGVzL2EuanNvbiIsCiAgICAgICAgICAgICJodHRwczovL21pcnJvci5leGFtcGxlLm5ldC9maXh0dXJlLXZvaWNlLzEuMC9zdHlsZXMvYS5qc29uIgogICAgICAgICAgXSwKICAgICAgICAgICJsaWNlbnNlSWQiOiAiZml4dHVyZS1yYWlsIgogICAgICAgIH0KICAgICAgXSwKICAgICAgImxpY2Vuc2VzIjogWwogICAgICAgIHsKICAgICAgICAgICJpZCI6ICJmaXh0dXJlLXJhaWwiLAogICAgICAgICAgIm5hbWUiOiAiRXhhbXBsZSBPcGVuIFJBSUwgTGljZW5zZSIsCiAgICAgICAgICAidGV4dFVSTCI6ICJodHRwczovL21vZGVscy5leGFtcGxlLm9yZy9maXh0dXJlLXZvaWNlL0xJQ0VOU0UiLAogICAgICAgICAgInRleHRTSEEyNTYiOiAiYjJiODVjNWIyODlhMWYwYWIwYjNiMzgxMjk3ZTFlNGM1MmE2YmViMGJlMGI4OWJhMWYzYjYzZmJjNDJiMTllNSIsCiAgICAgICAgICAicmVxdWlyZXNBY2NlcHRhbmNlIjogdHJ1ZSwKICAgICAgICAgICJyZXN0cmljdGlvbnNTdW1tYXJ5IjogIkRvIG5vdCB1c2UgdGhlIHZvaWNlIHRvIGltcGVyc29uYXRlIHNvbWVvbmUgd2l0aG91dCBjb25zZW50LiIKICAgICAgICB9CiAgICAgIF0KICAgIH0KICBdCn0K",
  "signature": "oLYUNfNmMc3ghsB7aBkbzpjVO8OxSMAefpSlQxMfaq16jCfDSvfspqRi4mnBN/nbGkNkPPRzM9kZPCDutRT/Dw=="
}
